<!ELEMENT BIBLIOTECA (LIBRO+)> 
<!ELEMENT LIBRO (AUTOR,TITULO,(YEAR|SIGLO),EDITORIAL)>
<!ATTLIST LIBRO COD CDATA #REQUIRED>
<!ELEMENT AUTOR (#PCDATA)>
<!ELEMENT TITULO (#PCDATA)>
<!ELEMENT YEAR (#PCDATA)>
<!ELEMENT EDITORIAL (#PCDATA)>
<!ELEMENT SIGLO (#PCDATA)>